appid,name,release_date,required_age,price,dlc_count,detailed_description,about_the_game,short_description,reviews,header_image,website,support_url,support_email,windows,mac,linux,metacritic_score,metacritic_url,achievements,recommendations,notes,supported_languages,full_audio_languages,packages,developers,publishers,categories,genres,screenshots,movies,user_score,score_rank,positive,negative,estimated_owners,average_playtime_forever,average_playtime_2weeks,median_playtime_forever,median_playtime_2weeks,discount,peak_ccu,tags,pct_pos_total,num_reviews_total,pct_pos_recent,num_reviews_recent
730,Counter-Strike 2,2012-08-21,0,0.0,1,"For over two decades, Counter-Strike has offered an elite competitive experience, one shaped by millions of players from across the globe. And now the next chapter in the CS story is about to begin. This is Counter-Strike 2. A free upgrade to CS:GO, Counter-Strike 2 marks the largest technical leap in Counter-Strike’s history. Built on the Source 2 engine, Counter-Strike 2 is modernized with realistic physically-based rendering, state of the art networking, and upgraded Community Workshop tools. In addition to the classic objective-focused gameplay that Counter-Strike pioneered in 1999, Counter-Strike 2 features: All-new CS Ratings with the updated Premier mode Global and Regional leaderboards Upgraded and overhauled maps Game-changing dynamic smoke grenades Tick-rate-independent gameplay Redesigned visual effects and audio All items from CS:GO moving forward to CS2 ","For over two decades, Counter-Strike has offered an elite competitive experience, one shaped by millions of players from across the globe. And now the next chapter in the CS story is about to begin. This is Counter-Strike 2. A free upgrade to CS:GO, Counter-Strike 2 marks the largest technical leap in Counter-Strike’s history. Built on the Source 2 engine, Counter-Strike 2 is modernized with realistic physically-based rendering, state of the art networking, and upgraded Community Workshop tools. In addition to the classic objective-focused gameplay that Counter-Strike pioneered in 1999, Counter-Strike 2 features: All-new CS Ratings with the updated Premier mode Global and Regional leaderboards Upgraded and overhauled maps Game-changing dynamic smoke grenades Tick-rate-independent gameplay Redesigned visual effects and audio All items from CS:GO moving forward to CS2 ","For over two decades, Counter-Strike has offered an elite competitive experience, one shaped by millions of players from across the globe. And now the next chapter in the CS story is about to begin. This is Counter-Strike 2.",,https://shared.akamai.steamstatic.com/store_item_assets/steam/apps/730/header.jpg?t=1729703045,http://counter-strike.net/,,,True,False,True,0,,1,4401572,Includes intense violence and blood.,"['Czech', 'Danish', 'Dutch', 'English', 'Finnish', 'French', 'German', 'Hungarian', 'Italian', 'Japanese', 'Korean', 'Norwegian', 'Polish', 'Portuguese - Portugal', 'Portuguese - Brazil', 'Romanian', 'Russian', 'Simplified Chinese', 'Spanish - Spain', 'Swedish', 'Thai', 'Traditional Chinese', 'Turkish', 'Bulgarian', 'Ukrainian', 'Greek', 'Spanish - Latin America', 'Vietnamese', 'Indonesian']","['English', 'Indonesian']","[{'title': 'Buy Counter-Strike 2', 'description': '', 'subs': [{'text': 'Counter-Strike 2 - Free', 'description': '', 'price': 0.0}, {'text': 'Prime Status Upgrade - $14.99', 'description': '', 'price': 14.99}]}]",['Valve'],['Valve'],"['Multi-player', 'Cross-Platform Multiplayer', 'Steam Trading Cards', 'Steam Workshop', 'In-App Purchases', 'Valve Anti-Cheat enabled', 'Stats', 'Remote Play on Phone', 'Remote Play on Tablet', 'Remote Play on TV', 'Steam Timeline']","['Action', 'Free To Play']","['https://shared.akamai.steamstatic.com/store_item_assets/steam/apps/730/ss_796601d9d67faf53486eeb26d0724347cea67ddc.1920x1080.jpg?t=1729703045', 'https://shared.akamai.steamstatic.com/store_item_assets/steam/apps/730/ss_d830cfd0550fbb64d80e803e93c929c3abb02056.1920x1080.jpg?t=1729703045', 'https://shared.akamai.steamstatic.com/store_item_assets/steam/apps/730/ss_13bb35638c0267759276f511ee97064773b37a51.1920x1080.jpg?t=1729703045', 'https://shared.akamai.steamstatic.com/store_item_assets/steam/apps/730/ss_0f8cf82d019c614760fd20801f2bb4001da7ea77.1920x1080.jpg?t=1729703045', 'https://shared.akamai.steamstatic.com/store_item_assets/steam/apps/730/ss_ef82850f036dac5772cb07dbc2d1116ea13eb163.1920x1080.jpg?t=1729703045', 'https://shared.akamai.steamstatic.com/store_item_assets/steam/apps/730/ss_76f6730dbb911650ba1f41c8e5b4bac638b5beea.1920x1080.jpg?t=1729703045', 'https://shared.akamai.steamstatic.com/store_item_assets/steam/apps/730/ss_808cdd373d78c3cf3a78e7026ebb1a15895e0670.1920x1080.jpg?t=1729703045', 'https://shared.akamai.steamstatic.com/store_item_assets/steam/apps/730/ss_ef98db5d5a4d877531a5567df082b0fb62d75c80.1920x1080.jpg?t=1729703045', 'https://shared.akamai.steamstatic.com/store_item_assets/steam/apps/730/ss_2254a50f27951fb9028bc00b93a7f2ed7aac1e13.1920x1080.jpg?t=1729703045', 'https://shared.akamai.steamstatic.com/store_item_assets/steam/apps/730/ss_54b9c26b028c84d5f8a5316f31ae6203953ed84d.1920x1080.jpg?t=1729703045', 'https://shared.akamai.steamstatic.com/store_item_assets/steam/apps/730/ss_1b3b5fd437939a7ed00a2155269e78994cb998d3.1920x1080.jpg?t=1729703045', 'https://shared.akamai.steamstatic.com/store_item_assets/steam/apps/730/ss_352666c1949ce3966bd966d6ea5a1afd532257bc.1920x1080.jpg?t=1729703045', 'https://shared.akamai.steamstatic.com/store_item_assets/steam/apps/730/ss_63d2733b9b4ace01a41d5ba8afd653245d05d54a.1920x1080.jpg?t=1729703045', 'https://shared.akamai.steamstatic.com/store_item_assets/steam/apps/730/ss_fe70d46859593aef623a0614f4686e2814405035.1920x1080.jpg?t=1729703045', 'https://shared.akamai.steamstatic.com/store_item_assets/steam/apps/730/ss_bb2af3e83ac0385ff2055f2ab9697cdd83e351b7.1920x1080.jpg?t=1729703045', 'https://shared.akamai.steamstatic.com/store_item_assets/steam/apps/730/ss_fb8e5e2ae29ce64e2898315c66b5db08989e8f91.1920x1080.jpg?t=1729703045', 'https://shared.akamai.steamstatic.com/store_item_assets/steam/apps/730/ss_0db84c628a798e38ca57d69abda119bee1358008.1920x1080.jpg?t=1729703045', 'https://shared.akamai.steamstatic.com/store_item_assets/steam/apps/730/ss_18e9ea2715f0407ee05e206073927a648db60d73.1920x1080.jpg?t=1729703045', 'https://shared.akamai.steamstatic.com/store_item_assets/steam/apps/730/ss_2514675f364079b754b820cbc8b2e7c331d56a26.1920x1080.jpg?t=1729703045']","['http://video.akamai.steamstatic.com/store_trailers/256972298/movie_max.mp4?t=1696005467', 'http://video.akamai.steamstatic.com/store_trailers/256970298/movie_max.mp4?t=1696005475', 'http://video.akamai.steamstatic.com/store_trailers/256969703/movie_max.mp4?t=1696005483', 'http://video.akamai.steamstatic.com/store_trailers/256969690/movie_max.mp4?t=1696005491']",0,,7480813,1135108,100000000 - 200000000,33189,879,5174,350,0,1212356,"{'FPS': 90857, 'Shooter': 65397, 'Multiplayer': 62332, 'Competitive': 53359, 'Action': 47512, 'Team-Based': 46430, 'e-sports': 43533, 'Tactical': 41354, 'First-Person': 39414, 'PvP': 34470, 'Online Co-Op': 33966, 'Co-op': 30263, 'Strategy': 30111, 'Military': 28699, 'War': 28006, 'Difficult': 25966, 'Trading': 25717, 'Realistic': 25430, 'Fast-Paced': 25318, 'Moddable': 6603}",86,8632939,82,96473
578080,PUBG: BATTLEGROUNDS,2017-12-21,0,0.0,0,"LAND, LOOT, SURVIVE! Play PUBG: BATTLEGROUNDS for free. Land on strategic locations, loot weapons and supplies, and survive to become the last team standing across various, diverse Battlegrounds. Squad up and join the Battlegrounds for the original Battle Royale experience that only PUBG: BATTLEGROUNDS can offer. This content download will also provide access to the BATTLEGROUNDS Test Server, which requires a separate download to play.  Optional in-game purchases available.","LAND, LOOT, SURVIVE! Play PUBG: BATTLEGROUNDS for free. Land on strategic locations, loot weapons and supplies, and survive to become the last team standing across various, diverse Battlegrounds. Squad up and join the Battlegrounds for the original Battle Royale experience that only PUBG: BATTLEGROUNDS can offer. This content download will also provide access to the BATTLEGROUNDS Test Server, which requires a separate download to play.  Optional in-game purchases available.","Play PUBG: BATTLEGROUNDS for free. Land on strategic locations, loot weapons and supplies, and survive to become the last team standing across various, diverse Battlegrounds. Squad up and join the Battlegrounds for the original Battle Royale experience that only PUBG: BATTLEGROUNDS can offer.",,https://shared.akamai.steamstatic.com/store_item_assets/steam/apps/578080/header.jpg?t=1736389084,https://www.pubg.com,https://support.pubg.com/hc/en-us,,True,False,False,0,,37,1732007,,"['English', 'Korean', 'Simplified Chinese', 'French', 'German', 'Spanish - Spain', 'Arabic', 'Japanese', 'Polish', 'Portuguese - Portugal', 'Russian', 'Turkish', 'Thai', 'Italian', 'Portuguese - Brazil', 'Traditional Chinese', 'Ukrainian']",[],[],['PUBG Corporation'],"['KRAFTON, Inc.']","['Multi-player', 'PvP', 'Online PvP', 'Stats', 'Remote Play on Phone', 'Remote Play on Tablet']","['Action', 'Adventure', 'Massively Multiplayer', 'Free To Play']","['https://shared.akamai.steamstatic.com/store_item_assets/steam/apps/578080/ss_1d009689dcded2de5771af55fb7134a77c4da642.1920x1080.jpg?t=1736389084', 'https://shared.akamai.steamstatic.com/store_item_assets/steam/apps/578080/ss_2da334ea597d9588aaa8c716d71b3c2e60a69853.1920x1080.jpg?t=1736389084', 'https://shared.akamai.steamstatic.com/store_item_assets/steam/apps/578080/ss_fe5340f8ea6e0d2f3899ef1e7d2ebdfc07e32f67.1920x1080.jpg?t=1736389084', 'https://shared.akamai.steamstatic.com/store_item_assets/steam/apps/578080/ss_1fc0cca99883a1dbaeaadfffc1492f81e4e77d32.1920x1080.jpg?t=1736389084', 'https://shared.akamai.steamstatic.com/store_item_assets/steam/apps/578080/ss_66e156cf716e72096c15c132c3443e774cb2f9a5.1920x1080.jpg?t=1736389084', 'https://shared.akamai.steamstatic.com/store_item_assets/steam/apps/578080/ss_63bb4a659968c3417ddd2ea5fd82cd2143e458a0.1920x1080.jpg?t=1736389084', 'https://shared.akamai.steamstatic.com/store_item_assets/steam/apps/578080/ss_3857268f02113c5095ff7bc73f814bd80ade8c2e.1920x1080.jpg?t=1736389084', 'https://shared.akamai.steamstatic.com/store_item_assets/steam/apps/578080/ss_034714c0f118657ac694c5b9c43bb647ed9ec051.1920x1080.jpg?t=1736389084', 'https://shared.akamai.steamstatic.com/store_item_assets/steam/apps/578080/ss_f148e1cd44da2972d1b61da1e12b7b3587c1f6a3.1920x1080.jpg?t=1736389084', 'https://shared.akamai.steamstatic.com/store_item_assets/steam/apps/578080/ss_c2456a0981b61eca4e84d3ff62fff6c78d61a6d0.1920x1080.jpg?t=1736389084', 'https://shared.akamai.steamstatic.com/store_item_assets/steam/apps/578080/ss_23af2e59855a833c22d0c11ca23a719f54a554ff.1920x1080.jpg?t=1736389084', 'https://shared.akamai.steamstatic.com/store_item_assets/steam/apps/578080/ss_8814c071f0cce53821d8e1b1a96de78d00e5d4d1.1920x1080.jpg?t=1736389084', 'https://shared.akamai.steamstatic.com/store_item_assets/steam/apps/578080/ss_109d7072cf85f5b3b1e3dacadf3009718db451c4.1920x1080.jpg?t=1736389084', 'https://shared.akamai.steamstatic.com/store_item_assets/steam/apps/578080/ss_4bbcaeac1ef977d962c60c1a5e4675cdd81de564.1920x1080.jpg?t=1736389084', 'https://shared.akamai.steamstatic.com/store_item_assets/steam/apps/578080/ss_5fe3d8ce7e90442569fc676e2315fffdf81dd1a5.1920x1080.jpg?t=1736389084', 'https://shared.akamai.steamstatic.com/store_item_assets/steam/apps/578080/ss_2b1f73afd6efb1952ee267e94f8bcc24ec5e8fb3.1920x1080.jpg?t=1736389084', 'https://shared.akamai.steamstatic.com/store_item_assets/steam/apps/578080/ss_52773275afe4c34a84fbf38e9960a598a420b3c2.1920x1080.jpg?t=1736389084', 'https://shared.akamai.steamstatic.com/store_item_assets/steam/apps/578080/ss_c98c609e2f07c80c8455624cc62696c9dde9ea73.1920x1080.jpg?t=1736389084', 'https://shared.akamai.steamstatic.com/store_item_assets/steam/apps/578080/ss_07590e851053a453e09c7d6f272adf602c3f8ee8.1920x1080.jpg?t=1736389084', 'https://shared.akamai.steamstatic.com/store_item_assets/steam/apps/578080/ss_56d29e4503ba1a74047feb55986c6bf4ca4297f9.1920x1080.jpg?t=1736389084', 'https://shared.akamai.steamstatic.com/store_item_assets/steam/apps/578080/ss_f96bc802fb38617ce790c0950b87a7979f096025.1920x1080.jpg?t=1736389084', 'https://shared.akamai.steamstatic.com/store_item_assets/steam/apps/578080/ss_108e2981889423b057b778cd07ae25ac18406cf1.1920x1080.jpg?t=1736389084', 'https://shared.akamai.steamstatic.com/store_item_assets/steam/apps/578080/ss_a403a1f4071d36d42bea7a505089b56b570b2569.1920x1080.jpg?t=1736389084']",[],0,,1487960,1024436,50000000 - 100000000,0,0,0,0,0,616738,"{'Survival': 14838, 'Shooter': 12727, 'Battle Royale': 10877, 'Multiplayer': 10837, 'FPS': 8428, 'PvP': 7703, 'Third-Person Shooter': 7322, 'Action': 6013, 'Online Co-Op': 5368, 'Tactical': 5058, 'Co-op': 4336, 'First-Person': 4090, 'Strategy': 3121, 'Early Access': 2829, 'Competitive': 2437, 'Third Person': 2369, 'Team-Based': 2090, 'Difficult': 1750, 'Simulation': 1390, 'Stealth': 1297}",59,2513842,68,16720
570,Dota 2,2013-07-09,0,0.0,2,"The most-played game on Steam. Every day, millions of players worldwide enter battle as one of over a hundred Dota heroes. And no matter if it's their 10th hour of play or 1,000th, there's always something new to discover. With regular updates that ensure a constant evolution of gameplay, features, and heroes, Dota 2 has truly taken on a life of its own. One Battlefield. Infinite Possibilities. When it comes to diversity of heroes, abilities, and powerful items, Dota boasts an endless array—no two games are the same. Any hero can fill multiple roles, and there's an abundance of items to help meet the needs of each game. Dota doesn't provide limitations on how to play, it empowers you to express your own style. All heroes are free. Competitive balance is Dota's crown jewel, and to ensure everyone is playing on an even field, the core content of the game—like the vast pool of heroes—is available to all players. Fans can collect cosmetics for heroes and fun add-ons for the world they inhabit, but everything you need to play is already included before you join your first match. Bring your friends and party up. Dota is deep, and constantly evolving, but it's never too late to join. Learn the ropes playing co-op vs. bots. Sharpen your skills in the hero demo mode. Jump into the behavior- and skill-based matchmaking system that ensures you'll be matched with the right players each game.","The most-played game on Steam. Every day, millions of players worldwide enter battle as one of over a hundred Dota heroes. And no matter if it's their 10th hour of play or 1,000th, there's always something new to discover. With regular updates that ensure a constant evolution of gameplay, features, and heroes, Dota 2 has truly taken on a life of its own. One Battlefield. Infinite Possibilities. When it comes to diversity of heroes, abilities, and powerful items, Dota boasts an endless array—no two games are the same. Any hero can fill multiple roles, and there's an abundance of items to help meet the needs of each game. Dota doesn't provide limitations on how to play, it empowers you to express your own style. All heroes are free. Competitive balance is Dota's crown jewel, and to ensure everyone is playing on an even field, the core content of the game—like the vast pool of heroes—is available to all players. Fans can collect cosmetics for heroes and fun add-ons for the world they inhabit, but everything you need to play is already included before you join your first match. Bring your friends and party up. Dota is deep, and constantly evolving, but it's never too late to join. Learn the ropes playing co-op vs. bots. Sharpen your skills in the hero demo mode. Jump into the behavior- and skill-based matchmaking system that ensures you'll be matched with the right players each game.","Every day, millions of players worldwide enter battle as one of over a hundred Dota heroes. And no matter if it's their 10th hour of play or 1,000th, there's always something new to discover. With regular updates that ensure a constant evolution of gameplay, features, and heroes, Dota 2 has taken on a life of its own.","“A modern multiplayer masterpiece.” 9.5/10 – Destructoid “Once you start to learn its secrets, there’s a wild and exciting variety of play here that’s unmatched, even by its peers.” 9.4/10 – IGN “Dota 2 is possibly the only competitive free-to-play game that is totally uncompromised by its business model.” 90/100 – PC Gamer ",https://shared.akamai.steamstatic.com/store_item_assets/steam/apps/570/header.jpg?t=1739210483,http://www.dota2.com/,,,True,True,True,90,https://www.metacritic.com/game/pc/dota-2?ftag=MCD-06-10aaa1f,0,14337,"Dota 2 includes fantasy violence, use of alcohol, and mild partial nudity.","['Bulgarian', 'Czech', 'Danish', 'Dutch', 'English', 'Finnish', 'French', 'German', 'Greek', 'Hungarian', 'Italian', 'Japanese', 'Korean', 'Norwegian', 'Polish', 'Portuguese - Portugal', 'Portuguese - Brazil', 'Romanian', 'Russian', 'Simplified Chinese', 'Spanish - Spain', 'Swedish', 'Thai', 'Traditional Chinese', 'Turkish', 'Ukrainian', 'Spanish - Latin America', 'Vietnamese']","['English', 'Korean', 'Simplified Chinese', 'Vietnamese']","[{'title': 'Buy Dota 2', 'description': '', 'subs': [{'text': 'Dota 2 - Commercial License - Free', 'description': '', 'price': 0.0}]}]",['Valve'],['Valve'],"['Multi-player', 'Co-op', 'Steam Trading Cards', 'Steam Workshop', 'SteamVR Collectibles', 'In-App Purchases', 'Valve Anti-Cheat enabled', 'Steam Timeline']","['Action', 'Strategy', 'Free To Play']","['https://shared.akamai.steamstatic.com/store_item_assets/steam/apps/570/ss_ad8eee787704745ccdecdfde3a5cd2733704898d.1920x1080.jpg?t=1739210483', 'https://shared.akamai.steamstatic.com/store_item_assets/steam/apps/570/ss_7ab506679d42bfc0c0e40639887176494e0466d9.1920x1080.jpg?t=1739210483', 'https://shared.akamai.steamstatic.com/store_item_assets/steam/apps/570/ss_c9118375a2400278590f29a3537769c986ef6e39.1920x1080.jpg?t=1739210483', 'https://shared.akamai.steamstatic.com/store_item_assets/steam/apps/570/ss_f9ebafedaf2d5cfb80ef1f74baa18eb08cad6494.1920x1080.jpg?t=1739210483', 'https://shared.akamai.steamstatic.com/store_item_assets/steam/apps/570/ss_27b6345f22243bd6b885cc64c5cda74e4bd9c3e8.1920x1080.jpg?t=1739210483', 'https://shared.akamai.steamstatic.com/store_item_assets/steam/apps/570/ss_b33a65678dc71cc98df4890e22a89601ee56a918.1920x1080.jpg?t=1739210483', 'https://shared.akamai.steamstatic.com/store_item_assets/steam/apps/570/ss_d0f973ce376ca5b6c08e081cb035e86ced105fa9.1920x1080.jpg?t=1739210483', 'https://shared.akamai.steamstatic.com/store_item_assets/steam/apps/570/ss_1f3b5f5ccf8b159294914c3fe028128a787304b6.1920x1080.jpg?t=1739210483', 'https://shared.akamai.steamstatic.com/store_item_assets/steam/apps/570/ss_e0a92f15a6631a8186df79182d0fe28b5e37d8cb.1920x1080.jpg?t=1739210483', 'https://shared.akamai.steamstatic.com/store_item_assets/steam/apps/570/ss_86d675fdc73ba10462abb8f5ece7791c5047072c.1920x1080.jpg?t=1739210483']","['http://video.akamai.steamstatic.com/store_trailers/256692021/movie_max.mp4?t=1739210452', 'http://video.akamai.steamstatic.com/store_trailers/256819789/movie_max.mp4?t=1739210455', 'http://video.akamai.steamstatic.com/store_trailers/2028243/movie_max.mp4?t=1739210460', 'http://video.akamai.steamstatic.com/store_trailers/81026/movie_max.mp4?t=1739210463', 'http://video.akamai.steamstatic.com/store_trailers/2040250/movie_max.mp4?t=1739210465']",0,,1998462,451338,200000000 - 500000000,43031,1536,898,892,0,555977,"{'Free to Play': 59933, 'MOBA': 20158, 'Multiplayer': 15359, 'Strategy': 14252, 'e-sports': 11780, 'Team-Based': 10962, 'Competitive': 8286, 'Action': 7920, 'Online Co-Op': 7464, 'PvP': 6046, 'Difficult': 5349, 'Co-op': 4316, 'RTS': 4110, 'RPG': 3792, 'Tower Defense': 3774, 'Fantasy': 3749, 'Character Customization': 2930, 'Replay Value': 2755, 'Action RPG': 2460, 'Simulation': 1979}",81,2452595,80,29366
